{
  "property_before": {
    "total_acres": 25.0,
    "frontage_linear_feet": 800.0,
    "road_classification": "highway",
    "shape_ratio_frontage_depth": 0.25,
    "value_per_acre": 100000.0,
    "use": "commercial",
    "buildable_area_sf": 200000,
    "development_potential_units": 10
  },
  "taking": {
    "area_taken_acres": 5.0,
    "frontage_lost_linear_feet": 200.0,
    "creates_landlocked": false,
    "eliminates_direct_access": true,
    "circuitous_access_added_minutes": 8.0,
    "creates_irregular_shape": true,
    "severs_utilities": true,
    "reduces_development_potential": true,
    "bisects_farm": false,
    "disrupts_irrigation": false
  },
  "remainder": {
    "acres": 20.0,
    "frontage_remaining_linear_feet": 600.0,
    "shape_ratio_frontage_depth": 0.20,
    "access_type": "circuitous",
    "buildable_area_sf": 120000,
    "development_potential_units": 7,
    "requires_new_fencing_linear_meters": 0.0,
    "irrigation_acres_affected": 0.0
  },
  "market_parameters": {
    "cap_rate": 0.07,
    "travel_time_value_per_hour": 40.0,
    "trips_per_day": 25,
    "business_days_per_year": 250
  }
}
