{
  "property_before": {
    "total_acres": 200.0,
    "frontage_linear_feet": 800.0,
    "road_classification": "highway",
    "shape_ratio_frontage_depth": 0.25,
    "value_per_acre": 40000.0,
    "use": "industrial",
    "development_potential_units": null,
    "buildable_area_sf": null
  },
  "taking": {
    "area_taken_acres": 10.0,
    "frontage_lost_linear_feet": 200.0,
    "creates_landlocked": false,
    "eliminates_direct_access": true,
    "circuitous_access_added_minutes": 6.0,
    "creates_irregular_shape": true,
    "severs_utilities": false,
    "reduces_development_potential": false,
    "bisects_farm": false,
    "disrupts_irrigation": false
  },
  "remainder": {
    "acres": 190.0,
    "frontage_remaining_linear_feet": 600.0,
    "shape_ratio_frontage_depth": 0.15,
    "access_type": "circuitous",
    "buildable_area_sf": null,
    "development_potential_units": null,
    "requires_new_fencing_linear_meters": 0.0,
    "irrigation_acres_affected": 0.0
  },
  "market_parameters": {
    "cap_rate": 0.07,
    "travel_time_value_per_hour": 40.0,
    "trips_per_day": 20,
    "business_days_per_year": 250
  }
}
