{
  "property_before": {
    "total_acres": 15.0,
    "frontage_linear_feet": 600.0,
    "road_classification": "arterial",
    "shape_ratio_frontage_depth": 0.15,
    "value_per_acre": 120000.0,
    "use": "commercial",
    "buildable_area_sf": 150000,
    "development_potential_units": null
  },
  "taking": {
    "area_taken_acres": 2.5,
    "frontage_lost_linear_feet": 150.0,
    "creates_landlocked": false,
    "eliminates_direct_access": false,
    "circuitous_access_added_minutes": 0.0,
    "creates_irregular_shape": true,
    "severs_utilities": false,
    "reduces_development_potential": false,
    "bisects_farm": false,
    "disrupts_irrigation": false
  },
  "remainder": {
    "acres": 12.5,
    "frontage_remaining_linear_feet": 450.0,
    "shape_ratio_frontage_depth": 0.10,
    "access_type": "direct",
    "buildable_area_sf": 100000,
    "development_potential_units": null,
    "requires_new_fencing_linear_meters": 0.0,
    "irrigation_acres_affected": 0.0
  },
  "market_parameters": {
    "cap_rate": 0.07,
    "travel_time_value_per_hour": 40.0,
    "trips_per_day": 20,
    "business_days_per_year": 250
  }
}
